{
  "schemaVersion": "0.1.0-draft.1",
  "status": "working-draft",
  "pathNotation": "Human-readable model selectors; not executable JSON Pointers or EXPRESS mappings",
  "sourceRegister": "docs/interoperability/sources.md",
  "mappings": [
    {
      "id": "step.identity",
      "oppModelPaths": [
        "Design.productDefinitions"
      ],
      "applicationProtocols": [
        "AP203",
        "AP214",
        "AP242"
      ],
      "sourceEntityFamilies": [
        "PRODUCT",
        "PRODUCT_DEFINITION"
      ],
      "mappingRule": "Preserve external product identity and resolve definition context.",
      "lossConditions": [
        "Product names are not globally unique; sender namespace is required."
      ],
      "evidence": [
        {
          "sourceId": "occt-step",
          "section": "Assembly structure"
        }
      ],
      "maturity": "documented-chain",
      "implementation": "not-implemented"
    },
    {
      "id": "step.revision",
      "oppModelPaths": [
        "ProductDefinition.revision"
      ],
      "applicationProtocols": [
        "AP203",
        "AP214",
        "AP242"
      ],
      "sourceEntityFamilies": [
        "PRODUCT_DEFINITION_FORMATION",
        "PRODUCT_DEFINITION_FORMATION_WITH_SPECIFIED_SOURCE"
      ],
      "mappingRule": "Use formation/revision context; preserve original identifiers.",
      "lossConditions": [
        "Do not substitute product_definition.id without context."
      ],
      "evidence": [
        {
          "sourceId": "cax-pmi-4.1",
          "section": "9.3.2"
        }
      ],
      "maturity": "candidate",
      "implementation": "not-implemented"
    },
    {
      "id": "step.exact-geometry",
      "oppModelPaths": [
        "Design.representations",
        "Manifest.resources"
      ],
      "applicationProtocols": [
        "AP203",
        "AP214",
        "AP242"
      ],
      "sourceEntityFamilies": [
        "PRODUCT_DEFINITION_SHAPE",
        "SHAPE_DEFINITION_REPRESENTATION",
        "ADVANCED_BREP_SHAPE_REPRESENTATION",
        "MANIFOLD_SOLID_BREP"
      ],
      "mappingRule": "Retain exact bytes and product-to-shape relationship; expose nominal role.",
      "lossConditions": [
        "Healed topology needs source map; unsupported geometry must remain source."
      ],
      "evidence": [
        {
          "sourceId": "occt-step",
          "section": "Models / Topological entities"
        }
      ],
      "maturity": "documented-chain",
      "implementation": "not-implemented"
    },
    {
      "id": "step.units",
      "oppModelPaths": [
        "CoordinateFrame.unit",
        "Quantity",
        "Transform.translationUnit"
      ],
      "applicationProtocols": [
        "AP203",
        "AP214",
        "AP242"
      ],
      "sourceEntityFamilies": [
        "GLOBAL_UNIT_ASSIGNED_CONTEXT",
        "SI_UNIT",
        "CONVERSION_BASED_UNIT",
        "MEASURE_WITH_UNIT"
      ],
      "mappingRule": "Resolve scale/dimension before serializing explicit OPP units.",
      "lossConditions": [
        "Affine temperatures, unsupported unit vocabulary, and uncertainty need explicit handling."
      ],
      "evidence": [
        {
          "sourceId": "occt-step",
          "section": "STEP units"
        }
      ],
      "maturity": "candidate",
      "implementation": "not-implemented"
    },
    {
      "id": "step.state",
      "oppModelPaths": [
        "Design.states",
        "Representation.stateId"
      ],
      "applicationProtocols": [
        "AP242"
      ],
      "sourceEntityFamilies": [
        "PRODUCT_DEFINITION_CONTEXT",
        "PROPERTY_DEFINITION"
      ],
      "mappingRule": "Resolve declared state semantics; require review when no exact source state exists.",
      "lossConditions": [
        "Do not infer coated/free/formed state solely from representation names."
      ],
      "evidence": [
        {
          "sourceId": "cax-current",
          "section": "Alternative Shapes v1.0"
        }
      ],
      "maturity": "candidate",
      "implementation": "not-implemented"
    },
    {
      "id": "step.assembly-occurrence",
      "oppModelPaths": [
        "Design.occurrences"
      ],
      "applicationProtocols": [
        "AP203",
        "AP214",
        "AP242"
      ],
      "sourceEntityFamilies": [
        "NEXT_ASSEMBLY_USAGE_OCCURRENCE"
      ],
      "mappingRule": "Map reusable definitions to distinct placements and preserve usage identity.",
      "lossConditions": [
        "Unresolved variants or external child definitions prevent resolved closure."
      ],
      "evidence": [
        {
          "sourceId": "occt-step",
          "section": "Assembly structure"
        }
      ],
      "maturity": "documented-chain",
      "implementation": "not-implemented"
    },
    {
      "id": "step.placement",
      "oppModelPaths": [
        "Occurrence.transform",
        "CoordinateFrame"
      ],
      "applicationProtocols": [
        "AP203",
        "AP214",
        "AP242"
      ],
      "sourceEntityFamilies": [
        "CONTEXT_DEPENDENT_SHAPE_REPRESENTATION",
        "SHAPE_REPRESENTATION_RELATIONSHIP_WITH_TRANSFORMATION",
        "ITEM_DEFINED_TRANSFORMATION",
        "MAPPED_ITEM"
      ],
      "mappingRule": "Normalize parent-from-child rigid transforms and source frame units.",
      "lossConditions": [
        "Reflection/scale is not an OPP rigid transform; conversion direction must be verified."
      ],
      "evidence": [
        {
          "sourceId": "occt-step",
          "section": "Assembly structure"
        }
      ],
      "maturity": "documented-chain",
      "implementation": "not-implemented"
    },
    {
      "id": "step.region-binding",
      "oppModelPaths": [
        "Region.bindingIds",
        "Bindings.bindings"
      ],
      "applicationProtocols": [
        "AP242"
      ],
      "sourceEntityFamilies": [
        "SHAPE_ASPECT",
        "GEOMETRIC_ITEM_SPECIFIC_USAGE",
        "ADVANCED_FACE"
      ],
      "mappingRule": "Preserve shape-aspect associations and emit hash-pinned entity selectors.",
      "lossConditions": [
        "Missing source entity map after healing is a binding failure."
      ],
      "evidence": [
        {
          "sourceId": "cax-pmi-4.1",
          "section": "5.1; 6.1"
        }
      ],
      "maturity": "documented-chain",
      "implementation": "not-implemented"
    },
    {
      "id": "step.multi-entity-feature",
      "oppModelPaths": [
        "Feature.regionIds",
        "Binding.entities"
      ],
      "applicationProtocols": [
        "AP242"
      ],
      "sourceEntityFamilies": [
        "COMPOSITE_GROUP_SHAPE_ASPECT",
        "SHAPE_ASPECT_RELATIONSHIP",
        "ITEM_IDENTIFIED_REPRESENTATION_USAGE"
      ],
      "mappingRule": "Preserve grouped feature/entity selection; distinguish pattern semantics.",
      "lossConditions": [
        "A group of elements and a pattern can require different engineering interpretation."
      ],
      "evidence": [
        {
          "sourceId": "cax-pmi-4.1",
          "section": "6.4; 6.4.1"
        }
      ],
      "maturity": "documented-chain",
      "implementation": "not-implemented"
    },
    {
      "id": "step.dimension-size",
      "oppModelPaths": [
        "Requirement[kind=dimension].spec"
      ],
      "applicationProtocols": [
        "AP242"
      ],
      "sourceEntityFamilies": [
        "DIMENSIONAL_SIZE",
        "DIMENSIONAL_CHARACTERISTIC_REPRESENTATION",
        "SHAPE_DIMENSION_REPRESENTATION"
      ],
      "mappingRule": "Translate defined size characteristic, measure and geometry association.",
      "lossConditions": [
        "Preserve inside/outside and derived-feature conventions; unsupported size types require profile."
      ],
      "evidence": [
        {
          "sourceId": "cax-pmi-4.1",
          "section": "5.1.5; 5.2"
        }
      ],
      "maturity": "documented-chain",
      "implementation": "not-implemented"
    },
    {
      "id": "step.dimension-location",
      "oppModelPaths": [
        "DimensionSpec.relatedSubjects",
        "DimensionSpec.direction"
      ],
      "applicationProtocols": [
        "AP242"
      ],
      "sourceEntityFamilies": [
        "DIMENSIONAL_LOCATION",
        "DIRECTED_DIMENSIONAL_LOCATION",
        "DIMENSIONAL_LOCATION_WITH_PATH"
      ],
      "mappingRule": "Keep both related subjects, measurement path, convention and orientation.",
      "lossConditions": [
        "Unrepresented center/inner/outer conventions block complete semantic translation."
      ],
      "evidence": [
        {
          "sourceId": "cax-pmi-4.1",
          "section": "5.1.1; 5.1.3; 5.1.4"
        }
      ],
      "maturity": "documented-chain",
      "implementation": "not-implemented"
    },
    {
      "id": "step.dimension-angle",
      "oppModelPaths": [
        "DimensionSpec.characteristic",
        "DimensionSpec.nominal"
      ],
      "applicationProtocols": [
        "AP242"
      ],
      "sourceEntityFamilies": [
        "ANGULAR_LOCATION",
        "ANGULAR_SIZE",
        "PLANE_ANGLE_MEASURE_WITH_UNIT"
      ],
      "mappingRule": "Translate angle value and selected small/large/reflex convention through supported profile.",
      "lossConditions": [
        "Core V0 lacks all angle-selection qualifiers; preserve unsupported cases explicitly."
      ],
      "evidence": [
        {
          "sourceId": "cax-pmi-4.1",
          "section": "5.1.2; 5.1.6"
        }
      ],
      "maturity": "documented-chain",
      "implementation": "not-implemented"
    },
    {
      "id": "step.dimension-offsets",
      "oppModelPaths": [
        "DimensionSpec.nominal",
        "DimensionSpec.limits"
      ],
      "applicationProtocols": [
        "AP242"
      ],
      "sourceEntityFamilies": [
        "PLUS_MINUS_TOLERANCE",
        "TOLERANCE_VALUE",
        "MEASURE_WITH_UNIT"
      ],